{
"FORM_TYP" : "P",
"ID" : "1",
"ID_PROJECT" : "",
"COPY_ID" : "",
"MANDANT" : "",
"ID_FORMTMP" : "2153",
"I_PROJECT" : "",
"I_FORM" : "",
"E_PROJECT" : "",
"INST_OUT" : "",
"WERK_IN" : "",
"WERK_OUT" : "",
"INST_IN" : "",
"PROJ_NR" : "",
"PROJ_JAHR" : "",
"WERK" : "EwiD",
"W_EMAIL" : "",
"W_EF_EMAIL" : "",
"VISUM" : "",
"I_NAME1" : "SaveControl GmbH",
"I_NAME2" : "Installationskontrolle",
"I_ADRESSE1" : "Birkenweg 23",
"I_ADRESSE2" : "Postfach 84",
"I_PLZ" : "6560",
"I_ORT" : "Neustadt",
"I_KONZESS" : "K-0101",
"I_SACHB" : "Simon Reber",
"I_TELNR" : "031 917 00 43",
"I_FAXNR" : "",
"I_EMAIL" : "resi@brunnerinformatik.ch",
"I_EF_EMAIL" : "",
"O_STRASSE" : "Brunnenweg",
"O_HAUSNR" : "51",
"O_PLZ" : "5623",
"O_ORT" : "Kleinwil",
"GEMEINDE" : "Kleinwil",
"PARZELLE" : "",
"VERSICH" : "",
"GEBAEUDEART" : "Schulhaus",
"GEBAEUDETEIL" : "",
"LAGE" : "3.OG",
"ANLNUTZUNG" : "Wohnung Abwart",
"U_NAME1" : "Gemeindeverwaltung",
"U_NAME2" : "",
"U_ADRESSE1" : "Brunnenweg 51",
"U_ADRESSE2" : "",
"U_PLZ" : "5623",
"U_ORT" : "Kleinwil",
"U_TELNR" : "",
"U_FAXNR" : "",
"U_EMAIL" : "",
"GEBAEUDENR" : "",
"EGID" : "",
"ABONR" : "",
"EVUAUFTNR" : "",
"TERMIN" : "20200731000000000",
"PACKNAME" : "ewid.evu",
"MP_NR" : "",
"RAPPORT_NR" : "",
"AN_INST" : "FALSE",
"AN_KONTR" : "TRUE",
"EIGENT" : "TRUE",
"VERW" : "FALSE",
"STROMK" : "FALSE",
"INST" : "FALSE",
"AG_X" : "FALSE",
"AG_XTEXT" : "",
"GES_NAME1" : "Gemeindeverwaltung",
"GES_NAME2" : "",
"GES_ADRESSE1" : "Brunnenweg 47",
"GES_ADRESSE2" : "",
"GES_PLZ" : "5623",
"GES_ORT" : "Kleinwil",
"GES_TELNR" : "",
"GES_FAXNR" : "",
"GES_EMAIL" : "",
"BEMERKUNG" : "",
"ZEV" : "FALSE",
"ZEV_TEXT" : "",
"ZAEHLER" : "04001",
"ANLJAHR0" : "20",
"ANL1" : "",
"ANLJAHR1" : "",
"ANL2" : "",
"ANLJAHR2" : "",
"MP_NEU" : "FALSE",
"MP_BEST" : "TRUE",
"MP_ANDERS" : "FALSE",
"MP_ERWEIT" : "FALSE",
"MP_X" : "FALSE",
"MP_XTEXT" : "",
"MP_SK" : "FALSE",
"MP_AK" : "FALSE",
"MP_PK" : "TRUE",
"MP_SP" : "FALSE",
"IA_DATUM" : "",
"KONDATUM_SK" : "",
"KONDATUM_AKPKSP" : "20200801000000000",
"KONDATUM" : "20200801000000000",
"KONTUMFANG" : "",
"S_1" : "FALSE",
"S_2" : "FALSE",
"S_3" : "FALSE",
"S_4" : "FALSE",
"S_5" : "FALSE",
"S_6" : "FALSE",
"S_7" : "FALSE",
"S_8" : "FALSE",
"S_9" : "FALSE",
"S_18" : "FALSE",
"S_18TEXT" : "",
"S_10" : "FALSE",
"S_TNS" : "FALSE",
"S_TNC" : "FALSE",
"S_TNCS" : "FALSE",
"S_SCH3" : "FALSE",
"S_TNX" : "FALSE",
"S_TNXTEXT" : "",
"S_12" : "FALSE",
"S_FUND" : "FALSE",
"S_TIEFENERDER" : "FALSE",
"S_BANDERDER" : "FALSE",
"S_ERDX" : "FALSE",
"S_ERDXTEXT" : "",
"S_11" : "FALSE",
"S_13" : "FALSE",
"S_14" : "FALSE",
"S_15" : "FALSE",
"S_16" : "FALSE",
"S_17" : "FALSE",
"F_1" : "FALSE",
"F_2" : "FALSE",
"F_3" : "FALSE",
"F_4" : "FALSE",
"F_5N" : "FALSE",
"F_6" : "FALSE",
"F_6TEXT" : "",
"F_SPANNUNG" : "",
"F_BEM" : "",
"N_MESSNORM" : "SN EN 61557",
"N_MESS1" : "",
"N_MESS2" : "",
"N_MESS3" : "",
"N_NORM1" : "FALSE",
"N_NORM1TEXT" : "NIV",
"N_NORM2" : "FALSE",
"N_NORM2TEXT" : "NIN SN 411000:2020",
"N_NORM3" : "FALSE",
"N_NORM3TEXT" : "HV",
"N_NORM4" : "FALSE",
"N_NORM4TEXT" : "SN EN 60204",
"N_NORM5" : "FALSE",
"N_NORM5TEXT" : "Werkvorschriften (TAB)",
"N_NORM6" : "FALSE",
"N_NORM6TEXT" : "D-A-CH-CZ",
"N_NORM7" : "FALSE",
"N_NORM7TEXT" : "SNR 464022",
"N_NORM8" : "FALSE",
"N_NORM8TEXT" : "SNR 464113",
"SKLISTE_BEMTITEL" : "Bemerkungen",
"SK_ASBEST0" : "FALSE",
"SK_ASBEST1" : "FALSE",
"SK_1" : "FALSE",
"SK_1NORM" : "EN 61439",
"SK_2" : "FALSE",
"SK_3" : "FALSE",
"DOKU" : "FALSE",
"SCHEMA" : "FALSE",
"ZUSATZ1" : "FALSE",
"ZUSTXT1" : "",
"OHNEMANGEL" : "FALSE",
"MANGELTEXT" : "",
"GGZ_NAME1" : "",
"GGZ_NAME2" : "",
"GGZ_ADRESSE1" : "",
"GGZ_ADRESSE2" : "",
"GGZ_PLZ" : "",
"GGZ_ORT" : "",
"GGZ_KONZESS" : "",
"GGZ_TELNR" : "",
"GGZ_EMAIL" : "",
"GGZ_DATUM" : "",
"GGZ_GRUND" : "",
"GGZ_SIGN" : "",
"GGZ_SIKT" : "",
"SIGN_DATUM" : "20210310000000000",
"KONTR_SIGN" : "OvpSU1Mx33n",
"KONTR_SIKT" : "Simon Reber",
"SKListeMESSPROT18_DE" : ""
}